URL,Title,Company,Job Title,holds or has held the title of principal researcher (or equivalent senior research role) (Criterion),holds or has held the title of principal researcher (or equivalent senior research role) (Reasoning),located in illinois (Criterion),located in illinois (Reasoning),Work Email (Result),Work Email (Reasoning),Field of Study (Result),Field of Study (Reasoning),State (Result),State (Reasoning),Profile Summary (Result),Profile Summary (Reasoning)
https://linkedin.com/in/sarah-forrestal-950b4b10,Sarah Forrestal,Mathematica,"Director, Survey Research / Data Collection",Yes,"Sarah Forrestal's LinkedIn profile shows that she held the title of 'Principal Researcher at Mathematica' from March 2021 to May 2021 (linkedin.com/in/sarah-forrestal-950b4b10). This directly satisfies the criterion.
References: [Sarah Forrestal | LinkedIn](https://www.linkedin.com/in/sarah-forrestal-950b4b10)",Yes,"Sarah Forrestal is currently located in Chicago, Illinois, United States, as stated in her LinkedIn profile. This directly satisfies the criterion of being located in Illinois, as Chicago is a city within the state. No additional information is needed to confirm this, as the location field clearly meets the requirement.
References: [Sarah Forrestal | LinkedIn](https://www.linkedin.com/in/sarah-forrestal-950b4b10)",,,,,,,"Sarah Forrestal is an experienced research professional specializing in survey methodology, data collection, and analysis with a focus on public health, child nutrition, and adolescent health. She currently serves as Director of Surveys and Data Collection at Mathematica and has held senior roles including Principal Researcher and Senior Researcher. Her expertise includes questionnaire design, qualitative and quantitative data analysis, and managing complex survey projects. She holds a PhD in Community Health Sciences with concentrations in Maternal and Child Health and Survey Research Methodology.","The summary is based on Sarah Forrestal's LinkedIn profile which details her current and past roles at Mathematica and University of Illinois at Chicago, highlighting her expertise in survey research, public health, and child nutrition. Her educational background with a PhD in Community Health Sciences and her professional experience managing survey data collection and analysis supports this concise professional summary.
References: [Sarah Forrestal](https://www.linkedin.com/in/sarah-forrestal-950b4b10)"
https://linkedin.com/in/raymond-fish-371a038,Raymond Fish,University of Illinois,Professor,Yes,"Raymond Fish's LinkedIn profile indicates he is a Professor at the University of Illinois and has been in a research-related role since 1978 (linkedin.com/in/raymond-fish-371a038). Search results confirm he has numerous publications and research interests, including trauma, electrical shock, and the interaction of law with medicine and medical engineering (brl.uiuc.edu/People/raymond_fish.php, researchgate.net/scientific-contributions/Raymond-M-Fish-32246648). Given his long tenure and extensive research contributions, it is reasonable to conclude that he has held a senior research role equivalent to a principal researcher.
References: [Principal Researcher - JR28527-3800 - IllinoisJobLink.com](https://illinoisjoblink.illinois.gov/jobs/12635614), [Eligibility to Serve as Principal Investigator of an Externally ...](https://cam.illinois.edu/policies/rp-06), [Eligibility to Serve as Principal Investigator of a Research Activity ...](https://cam.illinois.edu/policies/eligibility-to-serve-as-principal-investigator-of-a-research-activity-governed-by-compliance-requirements-new), [Principal Investigator Eligibility and Approval Procedures](https://research.uic.edu/principal-investigator-eligibility-and-approval-procedures), [Key Personnel - web.uillinois.edu](https://web.uillinois.edu/start_myresearch/my_proposals_help/key_personnel), [PI, Co-PI Eligibility, Roles and Responsibilities | Policy Library](https://www.niu.edu/policies/policy-documents/pi-co-pi-eligibility-roles-responsibilities.shtml), [Director and Principal Research Scientist - 1025602-6689 - Teal](https://www.tealhq.com/job/director-and-principal-research-scientist-1025602-6689_0c7cd469-9ab0-4e20-b959-4bf6633cf9dc), [Investigator Training | Office of the Vice Chancellor for Research](https://research.uic.edu/compliance/human-subjects-irbs/education-training-2), [Researcher Positions: Guidelines for Classification - SIU Policies](https://policies.siu.edu/personnel-policies/chapter5/researcher-positions.php), [Survey Director with Principal Research Scientist Role - Teal](https://www.tealhq.com/job/survey-director-with-principal-research-scientist-role-1025602-6689_fe5cd110-dd1c-4cbb-b563-ad421adfee6b), [Raymond Fish - the Bioacoustics Research Lab](https://www.brl.uiuc.edu/People/raymond_fish.php), [Raymond M Fish's research works | University of Illinois Urbana ...](https://www.researchgate.net/scientific-contributions/Raymond-M-Fish-32246648), [Obituary of Raymond Morris Fish | Fred C. Dames Funeral Homes](https://fredcdames.com/tribute/details/6282/Raymond-Fish/obituary.html), [Electrical Injuries - SUNY Oneonta Online Bookstore](https://oneonta.ecampus.com/electrical-injuries-2nd-fish-raymond-m/bk/9781933264639), [Stephen Boppart | Nuclear, Plasma & Radiological Engineering](https://npre.illinois.edu/people/profile/boppart), [Focused Ultrasound Treatment of Cervical Lymph Nodes in Rats ...](https://pubmed.ncbi.nlm.nih.gov/27639434), [Faculty Research Interests | Pharmaceutical Sciences](https://psci.pharmacy.uic.edu/faculty), [Research Reports - Illinois State Archaeological Survey](https://www.isas.illinois.edu/publications/research_reports), [Research | University of Illinois Springfield](https://www.uis.edu/emiquon/research), [Gregory W. Whitledge | Zoology Faculty | SIU](https://academics.siu.edu/science-and-mathematics/zoology/faculty/whitledge-gregory.php), [Raymond Fish | LinkedIn](https://www.linkedin.com/in/raymond-fish-371a038)",Yes,"Raymond Fish is currently located in Urbana, Illinois, United States, as stated in the LinkedIn profile. This directly satisfies the criterion of being located in Illinois. Therefore, based on the information provided, he meets the requirement of being located in Illinois.
References: [Raymond Fish | LinkedIn](https://www.linkedin.com/in/raymond-fish-371a038)",rfish@uillinois.edu,,Emergency Medicine and Electrical Injuries,"Raymond Fish's LinkedIn profile and research publications indicate his primary field of study and research specialization are in emergency medicine, electrocution consultation, trauma, and electrical shock. This aligns with emergency medicine and electrical injuries as his main field of study.
References: [Raymond Fish](https://www.linkedin.com/in/raymond-fish-371a038)",Illinois,"The LinkedIn profile of Raymond Fish states that his current location is Urbana, Illinois, United States. Urbana is a city in the state of Illinois, which directly satisfies the requirement to identify the U.S. state where he is currently located.
References: [Raymond Fish](https://www.linkedin.com/in/raymond-fish-371a038)","Raymond Fish is a Professor at the University of Illinois with over four decades of experience in academia and research. His expertise lies in emergency medicine and electrocution consultation, with significant research contributions in trauma, electrical shock, and the intersection of law, medicine, and medical engineering.","The summary is based on Raymond Fish's LinkedIn profile, highlighting his long tenure at the University of Illinois since 1978 and his specialized expertise and research interests as described in the profile and supporting research sources.
References: [Raymond Fish](https://www.linkedin.com/in/raymond-fish-371a038)"
https://linkedin.com/in/yanfei-peng-39645013,Yanfei Peng,USG,Sustainability Manager,Yes,"Yanfei Peng's LinkedIn profile indicates that she held the title of 'Principal Researcher' at United States Gypsum from May 2013 to March 2024 (linkedin.com/in/yanfei-peng-39645013). This satisfies the criterion.
References: [Yanfei Peng | LinkedIn](https://www.linkedin.com/in/yanfei-peng-39645013)",Yes,"Yanfei Peng is currently located in Chicago, Illinois, United States, as stated in the LinkedIn profile. This location directly satisfies the criterion, which accepts any city or region within Illinois as valid. Therefore, Yanfei Peng meets the requirement of being located in Illinois.
References: [Yanfei Peng | LinkedIn](https://www.linkedin.com/in/yanfei-peng-39645013)",ypeng@usg.com,,"Civil Engineering, specializing in construction materials and building product development","Yanfei Peng's education includes a BS in Civil Engineering (Structural Engineering) and a PhD in Civil Engineering (construction materials). Her professional experience as a Principal Researcher and Sustainability Manager at USG focuses on building product development and materials, confirming her primary field of study and specialization.
References: [Yanfei Peng](https://www.linkedin.com/in/yanfei-peng-39645013)",Illinois,"The LinkedIn profile of Yanfei Peng clearly states that her current location is Chicago, Illinois, United States. Chicago is a city in the state of Illinois, which directly satisfies the enrichment requirement to find the U.S. state where the person is currently located.
References: [Yanfei Peng](https://www.linkedin.com/in/yanfei-peng-39645013)","Yanfei Peng is an experienced R&D scientist and Sustainability Manager at USG, specializing in life cycle analysis of building materials. She has over 18 years of expertise in building product development, including technical leadership in developing DUROCK™ products and fast-setting concrete materials. Yanfei holds a PhD in Civil Engineering with a focus on construction materials from the University of Michigan and a BS in Civil Engineering from Southeast University. She is skilled in project management, six sigma, and raw material analysis. Yanfei is bilingual in English and Chinese and actively volunteers for human rights causes.","The summary is based on Yanfei Peng's LinkedIn profile which highlights her current sustainability role, extensive research and technical leadership experience at United States Gypsum, educational qualifications, and additional skills and volunteering activities.
References: [Yanfei Peng](https://www.linkedin.com/in/yanfei-peng-39645013)"
https://linkedin.com/in/yijun-sang-b17864a,Yijun Sang,USG Corporation,Principal Researcher,Yes,"Yijun Sang currently holds the title of Principal Researcher at USG Corporation since October 2016, which directly satisfies the criterion of holding the title of principal researcher or an equivalent senior research role. His previous role as Senior Researcher at the same company from June 2012 to September 2016 also indicates a senior position in research, although it is not an exact match for 'Principal Researcher.' Given the duration and nature of his current role, it is reasonable to conclude that he leads research projects and provides oversight, aligning with the responsibilities expected of a principal researcher. Therefore, Yijun Sang meets the criterion based on his current title and relevant experience (linkedin.com/in/yijun-sang-b17864a).
References: [Yijun Sang | LinkedIn](https://www.linkedin.com/in/yijun-sang-b17864a)",Yes,"Yijun Sang is currently located in Oak Park, Illinois, United States, as explicitly stated in the LinkedIn profile. This location meets the criterion of being located in Illinois. The profile provides clear evidence of his current location, which is sufficient to satisfy the requirement. Therefore, Yijun Sang does meet the criterion of being located in Illinois.
References: [Yijun Sang | LinkedIn](https://www.linkedin.com/in/yijun-sang-b17864a)",ysang@usg.com,,Grain Science & Industry with specialization in starch and building materials research,"Yijun Sang's highest degree is a PhD in Grain Science & Industry, and his professional research and patents focus on starch and gypsum board materials, indicating his primary field of study and research specialization.
References: [Yijun Sang](https://www.linkedin.com/in/yijun-sang-b17864a)",Illinois,"The LinkedIn profile explicitly states that Yijun Sang's current location is Oak Park, Illinois, United States. Oak Park is a village in the state of Illinois, which directly satisfies the criterion of the U.S. state where the person is currently located.
References: [Yijun Sang](https://www.linkedin.com/in/yijun-sang-b17864a)","Yijun Sang is an experienced Principal Researcher at USG Corporation with over 8 years in this role and a strong background in building materials, particularly gypsum board innovation. He holds a PhD in Grain Science & Industry and has expertise in R&D, chemistry, food processing, and starch transformation. He has a robust patent portfolio related to gypsum board compositions and starch applications, and a history of published research in food chemistry and material science. Located in Oak Park, Illinois, he has received multiple awards recognizing his contributions to research and development.","The summary was derived from Yijun Sang's LinkedIn profile, highlighting his current role as Principal Researcher, his educational background, expertise areas, patent achievements, publications, and awards. This provides a concise overview of his professional background and expertise.
References: [Yijun Sang](https://www.linkedin.com/in/yijun-sang-b17864a)"
https://linkedin.com/in/sharad-prof-aa574b9,Sharad Prof.,University of Illinois at Chicago,Associate Professor,Yes,"Sharad Prof. is currently an Associate Professor at the University of Illinois at Chicago. While the title 'Associate Professor' does not directly match 'Principal Researcher' or equivalent titles, it is important to note that this role typically involves significant responsibilities in research leadership. According to the University of Illinois Faculty Handbook, faculty members at this level are expected to engage in scholarly research, which includes leading research projects, mentoring students and junior faculty, and contributing to the academic community through research initiatives (source: https://facultyhandbook.uic.edu/sections/section-4-faculty-appointments/tenure-tenure-track-faculty-appointments). Additionally, the responsibilities of full-time faculty include teaching, research, and public service, which further supports the notion that an Associate Professor can fulfill a principal researcher role (source: https://facultyhandbook.uic.edu/sections/section-5-policies-governing-faculty-appointments/academic-freedom-and-faculty-responsibility). Therefore, while the title is not an exact match, the responsibilities associated with the role suggest that Sharad Prof. likely meets the criterion for holding an equivalent senior research role.
References: [Academic Freedom and Faculty Responsibility](https://facultyhandbook.uic.edu/sections/section-5-policies-governing-faculty-appointments/academic-freedom-and-faculty-responsibility), [Tenure/Tenure-Track Faculty/Appointments](https://facultyhandbook.uic.edu/sections/section-4-faculty-appointments/tenure-tenure-track-faculty-appointments), [What Do Associate Professors Do: Daily Work & Skills](https://www.franklin.edu/career-guide/postsecondary-teachers/what-do-associate-professors-do), [Non-Tenured Faculty/Appointments](https://facultyhandbook.uic.edu/sections/section-4-faculty-appointments/non-tenured-faculty-appointments), [Assistant/Associate Professor & Information Services and Liaison ...](https://www.carli.illinois.edu/assistant/associate-professor-information-services-and-liaison-librarian-liaison-medicine-%E2%80%93), [Sharad Prof. | LinkedIn](https://www.linkedin.com/in/sharad-prof-aa574b9)",Yes,"Sharad Prof. is located in the 'Greater Chicago Area,' which is a recognized region within Illinois. This directly satisfies the criterion for being located in Illinois. Furthermore, he is currently an Associate Professor at the University of Illinois at Chicago, reinforcing that he is based in Illinois. Therefore, he meets the criterion.
References: [Sharad Prof. | LinkedIn](https://www.linkedin.com/in/sharad-prof-aa574b9)",laxpati@uic.edu,,"Electrical and Computer Engineering, specializing in Electromagnetic theory, Antennae, Computational electromagnetic scattering, Microwaves, Wave propagation, and Communication.","The search results from the University of Illinois at Chicago's Electrical and Computer Engineering department profile for Sharad R. Laxpati indicate his research interests and field of study. This matches the name and position of the Associate Professor at UIC, confirming his primary field of study and research specialization.
References: [Laxpati, Sharad R | Electrical and Computer Engineering - UIC ECE](https://ece.uic.edu/profiles/sharad-r-laxpati-phd)",Illinois,"The LinkedIn profile indicates that Sharad Prof. is located in the 'Greater Chicago Area,' which is a recognized region within Illinois. Additionally, he is currently an Associate Professor at the University of Illinois at Chicago, which confirms his location in Illinois.
References: [Sharad Prof. - Associate Professor at University of Illinois at Chicago](https://www.linkedin.com/in/sharad-prof-aa574b9)","Sharad Prof. is an Associate Professor at the University of Illinois at Chicago, based in the Greater Chicago Area. He is engaged in academic teaching, research leadership, and mentoring within a research-intensive university environment. His role involves scholarly activities, contributing to research projects, and supporting the academic community through his expertise and leadership.","The summary is based on the LinkedIn profile information indicating his current position and location, combined with the typical responsibilities of an Associate Professor at a research university, as supported by the University of Illinois faculty handbook."
https://linkedin.com/in/vnvenkat,Venkat Venkatakrishnan,Discovery Partners Institute,Director of Research,Yes,"Venkat Venkatakrishnan's LinkedIn profile states that he maintains an energetic research program with over 13 million dollars in federal grant funding as Principal Investigator/ Co-Principal Investigator (linkedin.com/in/vnvenkat). This confirms that he has held the title of Principal Investigator, which satisfies the criterion.
References: [Venkat Venkatakrishnan | LinkedIn](https://www.linkedin.com/in/vnvenkat)",Yes,"Venkat Venkatakrishnan is currently located in the Greater Chicago Area, as stated in his LinkedIn profile. The Greater Chicago Area is part of Illinois, thus confirming that he meets the criterion of being located in Illinois.
References: [Venkat Venkatakrishnan | LinkedIn](https://www.linkedin.com/in/vnvenkat)",vvenkatakrishnan@uillinois.edu,,Computer Security and Privacy,"The LinkedIn profile explicitly states that Venkat Venkatakrishnan has several years of research experience in Computer Security and Privacy. His specialties include several subfields in cybersecurity such as Systems Security, Web Security, Mobile Security, Attacks and Defenses, Privacy, and Information Flow Analysis. His academic and professional roles also focus on computer security research and teaching, confirming this as his primary field of study.
References: [Venkat Venkatakrishnan](https://www.linkedin.com/in/vnvenkat)",Illinois,"The LinkedIn profile states that Venkat Venkatakrishnan's current location is the Greater Chicago Area, which is in Illinois. Additionally, his current roles at Discovery Partners Institute and University of Illinois at Chicago are located in Chicago, Illinois, confirming the state as Illinois.
References: [Venkat Venkatakrishnan](https://www.linkedin.com/in/vnvenkat)","Venkat Venkatakrishnan is a seasoned researcher and academic leader specializing in computer security and privacy. He currently serves as Director of Research at the Discovery Partners Institute, where he leads research strategy and partnerships to advance R&D in Chicago and Illinois. He is also a Professor of Computer Science at the University of Illinois at Chicago, with extensive experience in cybersecurity research, teaching, and program leadership. Venkat has managed over $13 million in federal grant funding as Principal Investigator and has a strong publication record in top security conferences. His expertise spans systems security, web and mobile security, attacks and defenses, privacy, and information flow analysis.","The summary is based on Venkat Venkatakrishnan's LinkedIn profile details, which highlight his current roles as Director of Research at Discovery Partners Institute and Professor at University of Illinois at Chicago. It includes his research leadership, funding achievements, teaching experience, and cybersecurity specialties as described in the profile.
References: [Venkat Venkatakrishnan](https://www.linkedin.com/in/vnvenkat)"
https://linkedin.com/in/cesar-chan-b700845,Cesar Chan,USG,"Director, Product Stewardship",Yes,"Cesar Chan's LinkedIn profile shows he held the position of 'Principal Researcher' at USG from Feb 2012 to Mar 2014 (linkedin.com/in/cesar-chan-b700845). This satisfies the criterion.
References: [Cesar Chan | LinkedIn](https://www.linkedin.com/in/cesar-chan-b700845)",Yes,"Cesar Chan's LinkedIn profile states his current location as Libertyville, Illinois, United States (linkedin.com/in/cesar-chan-b700845). This clearly indicates that he is located in Illinois.
References: [Cesar Chan | LinkedIn](https://www.linkedin.com/in/cesar-chan-b700845)",cchan@usg.com,,Civil & Environmental Engineering,"Cesar Chan's highest degree is a PhD in Civil & Environmental Engineering from Cornell University, which indicates his primary field of study. His professional experience also aligns with this specialization in building and construction materials, sustainability, and R&D in related areas.
References: [Cesar Chan](https://www.linkedin.com/in/cesar-chan-b700845)",Illinois,"The LinkedIn profile of Cesar Chan states his current location as Libertyville, Illinois, United States, which clearly indicates the U.S. state where he is currently located.
References: [Cesar Chan](https://www.linkedin.com/in/cesar-chan-b700845)","Cesar Chan is an experienced professional in the building and construction materials industry, specializing in R&D management, product development, product stewardship, and sustainability. He has held senior research roles including Principal Researcher at USG and has extensive expertise in lightweight technologies, safety, manufacturing efficiencies, and technology transfer. Currently, he is the Director of Product Stewardship at USG in Libertyville, Illinois, with a strong background in cross-functional leadership and innovation management across global settings.","The summary is based on Cesar Chan's LinkedIn profile which highlights his roles from Principal Researcher to Director, Product Stewardship at USG, his expertise in R&D, product innovation, sustainability, and leadership in the building materials sector. His multilingual skills and international experience further support his cross-functional and global capabilities.
References: [Cesar Chan](https://www.linkedin.com/in/cesar-chan-b700845)"
